{
  "$schema": "http://json-schema.org/draft-07/schema#",
  "title": "Project State",
  "type": "object",
  "properties": {
    "schema_version": {
      "type": "string"
    },
    "provenance": {
      "type": "object",
      "properties": {
        "generated_by": {
          "type": "string"
        },
        "timestamp": {
          "type": "string"
        },
        "bios_hash": {
          "type": "string"
        },
        "commit": {
          "type": "string"
        }
      }
    },
    "health": {
      "type": "object",
      "properties": {
        "tests_passing": {
          "type": "boolean"
        },
        "staleness_days": {
          "type": "integer"
        },
        "adrs_accumulated": {
          "type": "integer"
        },
        "maintenance_recommended": {
          "type": "boolean"
        }
      }
    },
    "capabilities": {
      "type": "object",
      "additionalProperties": {
        "type": "string",
        "enum": [
          "Stable",
          "Pilot",
          "Draft",
          "Planned",
          "Not Started"
        ]
      }
    }
  },
  "required": [
    "schema_version",
    "provenance",
    "health",
    "capabilities"
  ]
}